{
  "schema_version": "module-context.v1",
  "context_id": "scope_v1_module_context",
  "owner": "CounterGuard benchmark maintainers",
  "provenance": "D2 fixture architecture: package responsibilities established before scope learning; no applicability or compliance labels used.",
  "rules": [
    {
      "module_prefix": "examples.discount",
      "module_group": "retail",
      "basis": "This package contains retail membership pricing and discount interfaces across contract versions."
    },
    {
      "module_prefix": "examples.validation",
      "module_group": "shared_validation",
      "basis": "This package contains shared query and worker input validation across contract versions."
    }
  ],
  "artifact_digest": "sha256:8f55d8564259edb5b03bcfd82c4055eaf5e31f3025adbd00ed2dfa6f475b0691"
}
